{
  "version": 3,
  "command": "facts",
  "identity_scheme": "nauqtype.workspace.v1",
  "workspace": { "name": "tests.workspace_local_dependency", "entry_module": "workspace:tests.workspace_local_dependency::module:app::main" },
  "summary": {
    "modules": 3,
    "exports": 2,
    "call_edges": 2,
    "dependencies": 1
  },
  "dependencies": [
    {
      "alias": "reporting",
      "workspace": "tests.reporting",
      "path": "vendor/reporting",
      "manifest_sha256": "abfbf084b8f26d58a48b36782aa7c3ab1baeb17e2237423a831984d6fe3226a9",
      "source_sha256": "e9fb61bc3f47596f63d4c1d76d729ffdf57fe63af1839bbf87f0b50bbd466c77"
    }
  ],
  "modules": [
    {
      "id": "workspace:tests.reporting::module:values",
      "workspace": "tests.reporting",
      "module": "values",
      "source_module": "reporting::values",
      "evidence": "checked"
    },
    {
      "id": "workspace:tests.reporting::module:render",
      "workspace": "tests.reporting",
      "module": "render",
      "source_module": "reporting::render",
      "evidence": "checked"
    },
    {
      "id": "workspace:tests.workspace_local_dependency::module:app::main",
      "workspace": "tests.workspace_local_dependency",
      "module": "app::main",
      "source_module": "app::main",
      "evidence": "checked"
    }
  ],
  "exports": [
    {
      "id": "workspace:tests.reporting::module:values::fn:value",
      "legacy_id": "fn:reporting::values::value",
      "kind": "function",
      "name": "value",
      "evidence": "checked",
      "span": { "start": 7 }
    },
    {
      "id": "workspace:tests.reporting::module:render::fn:answer",
      "legacy_id": "fn:reporting::render::answer",
      "kind": "function",
      "name": "answer",
      "evidence": "checked",
      "span": { "start": 31 }
    }
  ],
  "call_graph": [
    {
      "caller": "workspace:tests.reporting::module:render::fn:answer",
      "callee": "workspace:tests.reporting::module:values::fn:value",
      "call_site": "workspace:tests.reporting::module:render::fn:answer@206",
      "evidence": "checked"
    },
    {
      "caller": "workspace:tests.workspace_local_dependency::module:app::main::fn:main",
      "callee": "workspace:tests.reporting::module:render::fn:answer",
      "call_site": "workspace:tests.workspace_local_dependency::module:app::main::fn:main@73",
      "evidence": "checked"
    }
  ]
}
