{
  "version": 3,
  "command": "facts",
  "identity_scheme": "nauqtype.workspace.v1",
  "workspace": { "name": "org.operations_tool", "entry_module": "workspace:org.operations_tool::module:app::main" },
  "summary": {
    "modules": 3,
    "exports": 2,
    "call_edges": 3,
    "dependencies": 1
  },
  "dependencies": [
    {
      "alias": "reporting",
      "workspace": "org.reporting",
      "path": "vendor/reporting",
      "manifest_sha256": "f561a8104fe021796d38fec6ee5dbf05ea6a466dd35e8d4a79849bd4546ded0d",
      "source_sha256": "6446e66cd177886481fdcaf722df30dca0f3188109485662f667ab8bc1d72d82"
    }
  ],
  "modules": [
    {
      "id": "workspace:org.reporting::module:template",
      "workspace": "org.reporting",
      "module": "template",
      "source_module": "reporting::template",
      "evidence": "checked"
    },
    {
      "id": "workspace:org.reporting::module:render",
      "workspace": "org.reporting",
      "module": "render",
      "source_module": "reporting::render",
      "evidence": "checked"
    },
    {
      "id": "workspace:org.operations_tool::module:app::main",
      "workspace": "org.operations_tool",
      "module": "app::main",
      "source_module": "app::main",
      "evidence": "checked"
    }
  ],
  "exports": [
    {
      "id": "workspace:org.reporting::module:template::fn:approved_text",
      "legacy_id": "fn:reporting::template::approved_text",
      "kind": "function",
      "name": "approved_text",
      "evidence": "checked",
      "span": { "start": 7 }
    },
    {
      "id": "workspace:org.reporting::module:render::fn:status_line",
      "legacy_id": "fn:reporting::render::status_line",
      "kind": "function",
      "name": "status_line",
      "evidence": "checked",
      "span": { "start": 33 }
    }
  ],
  "call_graph": [
    {
      "caller": "workspace:org.reporting::module:render::fn:status_line",
      "callee": "workspace:org.reporting::module:template::fn:approved_text",
      "call_site": "workspace:org.reporting::module:render::fn:status_line@191",
      "evidence": "checked"
    },
    {
      "caller": "workspace:org.operations_tool::module:app::main::fn:main",
      "callee": "builtin:print_line",
      "call_site": "workspace:org.operations_tool::module:app::main::fn:main@177",
      "evidence": "builtin"
    },
    {
      "caller": "workspace:org.operations_tool::module:app::main::fn:main",
      "callee": "workspace:org.reporting::module:render::fn:status_line",
      "call_site": "workspace:org.operations_tool::module:app::main::fn:main@207",
      "evidence": "checked"
    }
  ]
}
